{
  "schemaVersion": "pack-4-draft",
  "id": "biq-001",
  "sourceDecisionIds": [
    "BOOK-002"
  ],
  "bookingItemId": "item-001",
  "ordered": {
    "quantity": 10,
    "unitLabel": "people"
  },
  "productionConversion": {
    "conversionType": "pieces_per_person",
    "factor": 2,
    "outputUnitLabel": "pieces",
    "sourceReference": "approved-hospitality-brochure-or-production-process"
  },
  "productionQuantity": {
    "quantity": 20,
    "unitLabel": "pieces"
  },
  "createdAt": "2026-07-14T19:00:00Z",
  "updatedAt": "2026-07-14T19:00:00Z"
}
